{"as_of":"2026-10-18","fetched_at":"2026-10-18T10:05Z","sources":["USDA NASS QuickStats county yields, IA, 2008-2025 (survey)","NASA POWER daily T2M_MAX, T2M_MIN, PRECTOTCORR at each county centroid (no key)","US Census Bureau 2023 county gazetteer (centroids)"],"state":"IA","target_fips":"19169","crops":{"corn":{"county":"Story County","county_fips":"19169","years":[2008,2009,2010,2011,2012,2013,2014,2015,2016,2017,2018,2019,2020,2021,2022,2023,2024,2025],"n_train":1678,"n_counties":99,"features":["gdd","heat32","heat35","p_may","p_jun","p_jul","p_aug","p_sep","dry_spell","frost_doy","trend","county_mean"],"lambda":100.0,"coefficients":{"gdd":2.2526,"heat32":-4.3911,"heat35":-10.7038,"p_may":-3.8527,"p_jun":-8.5492,"p_jul":0.2364,"p_aug":2.0935,"p_sep":-0.5135,"dry_spell":-2.5138,"frost_doy":0.8372,"trend":12.4207,"county_mean":10.6613},"intercept":181.966,"feature_mean":{"gdd":1624.771,"heat32":11.039,"heat35":4.222,"p_may":114.295,"p_jun":140.453,"p_jul":101.032,"p_aug":99.5,"p_sep":80.963,"dry_spell":10.058,"frost_doy":291.983,"trend":16.162,"county_mean":181.966},"feature_std":{"gdd":155.49,"heat32":12.316,"heat35":7.313,"p_may":46.211,"p_jun":67.26,"p_jul":56.779,"p_aug":53.213,"p_sep":55.853,"dry_spell":3.445,"frost_doy":8.808,"trend":5.112,"county_mean":14.625},"rmse_bu_per_acre":17.51,"bias_bu_per_acre":0.88,"r2":0.621,"loyo_years":[{"year":2008,"n":99,"rmse":19.02,"bias":-15.72},{"year":2009,"n":99,"rmse":10.44,"bias":-0.41},{"year":2010,"n":99,"rmse":31.84,"bias":21.75},{"year":2011,"n":99,"rmse":11.98,"bias":3.56},{"year":2012,"n":99,"rmse":29.43,"bias":21.31},{"year":2013,"n":99,"rmse":14.72,"bias":5.75},{"year":2014,"n":99,"rmse":13.55,"bias":-8.71},{"year":2015,"n":95,"rmse":7.49,"bias":-3.14},{"year":2016,"n":99,"rmse":6.92,"bias":1.83},{"year":2017,"n":95,"rmse":15.43,"bias":-8.27},{"year":2018,"n":93,"rmse":21.74,"bias":-15.13},{"year":2019,"n":88,"rmse":10.72,"bias":0.41},{"year":2020,"n":95,"rmse":21.38,"bias":14.41},{"year":2021,"n":84,"rmse":15.85,"bias":1.44},{"year":2022,"n":97,"rmse":9.3,"bias":-0.54},{"year":2023,"n":87,"rmse":15.36,"bias":1.11},{"year":2024,"n":73,"rmse":21.61,"bias":-17.6},{"year":2025,"n":79,"rmse":13.14,"bias":9.74}],"hindcast":[{"year":2008,"actual":160.0,"predicted":148.98},{"year":2009,"actual":174.7,"predicted":177.56},{"year":2010,"actual":163.9,"predicted":184.17},{"year":2011,"actual":163.2,"predicted":175.5},{"year":2012,"actual":157.6,"predicted":152.11},{"year":2013,"actual":137.2,"predicted":165.85},{"year":2014,"actual":169.9,"predicted":171.43},{"year":2015,"actual":188.0,"predicted":187.26},{"year":2016,"actual":211.9,"predicted":206.6},{"year":2017,"actual":200.3,"predicted":190.8},{"year":2018,"actual":192.3,"predicted":180.1},{"year":2019,"actual":189.3,"predicted":199.09},{"year":2020,"actual":148.4,"predicted":194.77},{"year":2021,"actual":201.2,"predicted":199.25},{"year":2022,"actual":207.1,"predicted":196.47},{"year":2023,"actual":211.4,"predicted":198.42},{"year":2024,"actual":215.5,"predicted":196.82},{"year":2025,"actual":204.0,"predicted":219.29}],"estimate_bu_per_acre":217.9,"interval_bu_per_acre":[189.2,246.6],"target":{"gdd":1778.3,"heat32":16,"heat35":3,"p_may":63.2,"p_jun":119.1,"p_jul":165.0,"p_aug":121.0,"p_sep":216.3,"dry_spell":10,"frost_doy":314,"trend":26,"days_observed":153,"days_filled":0,"county_mean":183.10555555555553,"year":2026,"observed_through":"2026-10-18"},"method":"Ridge regression of county yield on growing-season weather (degree days, heat-stress days, rain by month, dry spell, first frost), a year trend and the county baseline (its mean yield in the other years), trained on measured USDA county yields for every county in the state and validated leave-one-year-out; the band is 1.64 times the held-out error. A county estimate, not a field measurement."},"soybean":{"county":"Story County","county_fips":"19169","years":[2008,2009,2010,2011,2012,2013,2014,2015,2016,2017,2018,2019,2020,2021,2022,2023,2024,2025],"n_train":1645,"n_counties":99,"features":["gdd","heat32","heat35","p_may","p_jun","p_jul","p_aug","p_sep","dry_spell","frost_doy","trend","county_mean"],"lambda":100.0,"coefficients":{"gdd":1.1421,"heat32":0.0806,"heat35":-2.6228,"p_may":-1.0659,"p_jun":-1.6052,"p_jul":0.8524,"p_aug":1.3093,"p_sep":-0.2778,"dry_spell":-0.5313,"frost_doy":-0.06,"trend":3.5451,"county_mean":2.9742},"intercept":53.661,"feature_mean":{"gdd":1625.055,"heat32":11.096,"heat35":4.255,"p_may":114.223,"p_jun":140.906,"p_jul":100.955,"p_aug":99.769,"p_sep":81.254,"dry_spell":10.044,"frost_doy":291.914,"trend":16.032,"county_mean":53.661},"feature_std":{"gdd":156.044,"heat32":12.396,"heat35":7.367,"p_may":45.867,"p_jun":67.487,"p_jul":57.018,"p_aug":53.286,"p_sep":55.617,"dry_spell":3.449,"frost_doy":8.797,"trend":5.081,"county_mean":3.624},"rmse_bu_per_acre":4.0,"bias_bu_per_acre":0.03,"r2":0.708,"loyo_years":[{"year":2008,"n":99,"rmse":3.78,"bias":0.42},{"year":2009,"n":99,"rmse":4.12,"bias":1.81},{"year":2010,"n":99,"rmse":3.38,"bias":0.7},{"year":2011,"n":99,"rmse":4.1,"bias":-2.19},{"year":2012,"n":99,"rmse":5.01,"bias":-2.58},{"year":2013,"n":99,"rmse":5.95,"bias":3.69},{"year":2014,"n":99,"rmse":3.21,"bias":1.53},{"year":2015,"n":97,"rmse":3.01,"bias":-1.11},{"year":2016,"n":99,"rmse":3.66,"bias":-1.44},{"year":2017,"n":96,"rmse":3.47,"bias":-0.96},{"year":2018,"n":96,"rmse":3.23,"bias":0.25},{"year":2019,"n":82,"rmse":3.0,"bias":0.14},{"year":2020,"n":86,"rmse":4.04,"bias":0.45},{"year":2021,"n":76,"rmse":4.32,"bias":-3.13},{"year":2022,"n":97,"rmse":3.81,"bias":0.79},{"year":2023,"n":82,"rmse":5.66,"bias":2.72},{"year":2024,"n":68,"rmse":3.79,"bias":-1.96},{"year":2025,"n":73,"rmse":2.49,"bias":0.79}],"hindcast":[{"year":2008,"actual":46.5,"predicted":45.73},{"year":2009,"actual":52.5,"predicted":51.26},{"year":2010,"actual":48.4,"predicted":54.16},{"year":2011,"actual":51.7,"predicted":49.93},{"year":2012,"actual":48.9,"predicted":41.45},{"year":2013,"actual":40.4,"predicted":48.52},{"year":2014,"actual":46.9,"predicted":53.26},{"year":2015,"actual":51.0,"predicted":56.17},{"year":2016,"actual":58.4,"predicted":59.31},{"year":2017,"actual":57.9,"predicted":55.28},{"year":2018,"actual":52.8,"predicted":56.72},{"year":2019,"actual":50.0,"predicted":56.32},{"year":2020,"actual":52.2,"predicted":55.17},{"year":2021,"actual":63.6,"predicted":59.42},{"year":2022,"actual":60.0,"predicted":59.56},{"year":2023,"actual":64.1,"predicted":59.43},{"year":2024,"actual":63.2,"predicted":58.83},{"year":2025,"actual":63.6,"predicted":64.28}],"estimate_bu_per_acre":64.9,"interval_bu_per_acre":[58.3,71.4],"target":{"gdd":1778.3,"heat32":16,"heat35":3,"p_may":63.2,"p_jun":119.1,"p_jul":165.0,"p_aug":121.0,"p_sep":216.3,"dry_spell":10,"frost_doy":314,"trend":26,"days_observed":153,"days_filled":0,"county_mean":54.00555555555555,"year":2026,"observed_through":"2026-10-18"},"method":"Ridge regression of county yield on growing-season weather (degree days, heat-stress days, rain by month, dry spell, first frost), a year trend and the county baseline (its mean yield in the other years), trained on measured USDA county yields for every county in the state and validated leave-one-year-out; the band is 1.64 times the held-out error. A county estimate, not a field measurement."}}}